{
  "version": "1.0.0",
  "last_updated": "2026-02-06T00:00:00Z",
  "preferences": {
    "response_style": "concise",
    "examples": "only_when_requested",
    "emoji": "never",
    "technical_level": "advanced"
  },
  "workflow": {
    "prefer_scripts": false,
    "prefer_json_edits": true,
    "testing_required": true,
    "version_control": "active"
  },
  "projects": [
    {
      "name": "general",
      "notes": "Keep responses concise and actionable."
    }
  ]
}
